{
    "$schema": "../signature.schema.json",
    "theme": "formal",
    "idea": "Paper and ink: a warm off-white stock, near-black ink with a blue cast, and one navy that carries every interactive thing, with bronze and gold as a second voice that never acts. Fraunces on the headings is the whole typographic gesture. Formal stays still while the others move: motion commits once, as a fade, a rise or a rule that draws, and never glitches, loops or flickers.",
    "loadBearing": [
        {
            "claim": "The ground is a warm off-white; moved to pure white, the theme becomes light.",
            "proof": [{ "file": "themes/formal/tokens.json", "token": "background" }]
        },
        {
            "claim": "One colour acts: navy is the only hue that means you can do something here.",
            "proof": [
                { "file": "themes/formal/tokens.json", "token": "primary" },
                { "file": "css/formal-register.css", "selector": "[data-theme='formal'] .kp-nav__link--cta" },
                { "file": "css/formal-register.css", "selector": "[data-theme='formal'] .kp-button--ghost" }
            ]
        },
        {
            "claim": "No ornament: no glow, no visible texture, no flourish; the 0.375rem radius is the largest concession.",
            "proof": [
                { "file": "themes/formal/tokens.json", "token": "radius" },
                { "file": "css/formal-register.css", "selector": "[data-theme='formal'] .kp-card" }
            ]
        },
        {
            "claim": "The display serif is for headings only, at its highest optical size on a surface.",
            "proof": [
                { "file": "css/formal-register.css", "selector": "[data-theme='formal'] h1" },
                { "file": "css/formal-register.css", "selector": "[data-theme='formal'] [data-kp-surface] h1" }
            ]
        },
        {
            "claim": "Motion commits, it does not perform: every reveal is a one-shot transition and the register has no keyframes.",
            "proof": [
                { "file": "css/formal-register.css", "property": "--kp-reveal-headline" },
                { "file": "css/formal-register.css", "selector": "[data-theme='formal'] [data-kp-reveal='headline']" }
            ]
        }
    ],
    "colourRoles": [
        {
            "role": "Paper",
            "token": "background",
            "use": "The page ground and the ground of a field, so an input is a ruled box on the page.",
            "never": "Pure white, which reads as a screen rather than a page.",
            "example": "surface-app",
            "proof": [
                { "file": "themes/formal/tokens.json", "token": "background" },
                { "file": "css/formal-register.css", "selector": "[data-theme='formal'] .kp-field__input" }
            ]
        },
        {
            "role": "Card stock",
            "token": "card",
            "use": "A brighter stock laid on the page: cards, every panel, the navbar, the hero.",
            "never": "The fill of a control.",
            "example": "card",
            "proof": [
                { "file": "themes/formal/tokens.json", "token": "card" },
                { "file": "css/formal-register.css", "selector": "[data-theme='formal'] .kp-nav-wrap" },
                { "file": "css/formal-register.css", "selector": "[data-theme='formal'] [data-kp-surface='hero']" }
            ]
        },
        {
            "role": "Ink",
            "token": "foreground",
            "use": "Running text, headings and field labels.",
            "never": "Pure black.",
            "example": "text-body",
            "proof": [
                { "file": "themes/formal/tokens.json", "token": "foreground" },
                { "file": "css/formal-register.css", "selector": "[data-theme='formal'] .kp-field__label" }
            ]
        },
        {
            "role": "Navy",
            "token": "primary",
            "use": "Everything that acts: the primary button, the call to action, a ghost button's label, the selected tab, the current page, a sorted column; and the two rules that close a section, the drawn heading rule and the docket tick.",
            "never": "Decoration unrelated to an action or a section's end.",
            "example": "button-primary",
            "proof": [
                { "file": "themes/formal/tokens.json", "token": "primary" },
                { "file": "css/formal-register.css", "selector": "[data-theme='formal'] .kp-tab[aria-selected='true']" },
                { "file": "css/formal-register.css", "selector": "[data-theme='formal'] [data-kp-divider]:not([data-kp-divider='alt'])::after" }
            ]
        },
        {
            "role": "Bronze wash",
            "token": "accent",
            "use": "The highlighter under a marked phrase.",
            "never": "A button, or any other thing that acts.",
            "example": "lede",
            "proof": [
                { "file": "themes/formal/tokens.json", "token": "accent" },
                { "file": "css/formal-register.css", "selector": "[data-theme='formal'] mark" }
            ]
        },
        {
            "role": "Gold signal",
            "token": "fx-signal",
            "use": "Wet ink: the mirror button's 2px offset impression and the laurels' glyphs.",
            "never": "A control's fill or its label.",
            "example": "button-mirror",
            "proof": [
                { "file": "themes/formal/tokens.json", "token": "fx-signal" },
                { "file": "css/formal-register.css", "selector": "[data-theme='formal'] .kp-button--mirror" },
                { "file": "css/formal-register.css", "selector": "[data-theme='formal'] .kp-laurels svg" }
            ]
        },
        {
            "role": "Brick",
            "token": "destructive",
            "use": "The stamp's ink and frame, the destructive button, an invalid field's border, an error.",
            "never": "Emphasis that is not a warning or a stamp.",
            "example": "button-destructive",
            "proof": [
                { "file": "themes/formal/tokens.json", "token": "destructive" },
                { "file": "css/formal-register.css", "selector": "[data-theme='formal'] .kp-card[data-kp-label]::before" },
                { "file": "css/formal-register.css", "selector": "[data-theme='formal'] .kp-field--invalid .kp-field__input" }
            ]
        },
        {
            "role": "Rule",
            "token": "border-strong",
            "use": "A control's boundary (a field, a ghost button), the rule under a table's header, the divider's hairline.",
            "never": "The quiet rule between paragraphs; that is the hairline.",
            "example": "field",
            "proof": [
                { "file": "themes/formal/tokens.json", "token": "border-strong" },
                { "file": "css/formal-register.css", "selector": "[data-theme='formal'] [data-kp-divider]::before" },
                { "file": "css/formal-register.css", "selector": "[data-theme='formal'] .kp-table th" }
            ]
        },
        {
            "role": "Hairline",
            "token": "border",
            "use": "The quiet content rule: card and panel frames, the navbar's bottom line, table rows.",
            "never": "A control boundary (DI1).",
            "example": "card",
            "proof": [
                { "file": "themes/formal/tokens.json", "token": "border" },
                { "file": "css/formal-register.css", "selector": "[data-theme='formal'] .kp-table td" }
            ]
        },
        {
            "role": "Muted stock",
            "token": "muted",
            "use": "The darker third stock: the dossier, the footer, a secondary button, a hovered menu row, the current side navigation row.",
            "never": "A ground for long reading.",
            "example": "dossier",
            "proof": [
                { "file": "themes/formal/tokens.json", "token": "muted" },
                { "file": "css/formal-register.css", "selector": "[data-theme='formal'] .kp-footer" },
                { "file": "css/formal-register.css", "selector": "[data-theme='formal'] .kp-card[data-kp-reveal='emphasis']" }
            ]
        }
    ],
    "type": [
        {
            "role": "Display",
            "font": "theme-font-display",
            "scale": "kp-text-display",
            "case": "as written",
            "tracking": "-0.03em on a surface headline, -0.02em on an app heading",
            "weight": "560 headings, 600 card titles",
            "description": "Fraunces with its optical size at work: 144 on the headline, 90 on an app heading, 60 on card and dialog titles, 40 on the wordmark.",
            "example": "hero-headline",
            "proof": [
                { "file": "css/formal-register.css", "selector": "[data-theme='formal'] h1" },
                { "file": "css/formal-register.css", "selector": "[data-theme='formal'] [data-kp-surface] h1" },
                { "file": "css/formal-register.css", "selector": "[data-theme='formal'] [data-kp-surface='app'] h2" }
            ]
        },
        {
            "role": "Body",
            "font": "theme-font-body",
            "scale": "kp-text-md",
            "case": "as written",
            "weight": "600 on buttons and labels",
            "description": "Instrument Sans for everything that is not a heading: text, buttons, labels, the tree, identifiers.",
            "example": "text-body",
            "proof": [
                { "file": "themes/formal/tokens.json", "token": "theme-font-body" },
                { "file": "css/formal-register.css", "selector": "[data-theme='formal'] .kp-button" }
            ]
        },
        {
            "role": "Masthead line",
            "font": "theme-font-body",
            "case": "uppercase",
            "tracking": "0.16em",
            "weight": "600",